{
  "firma_id": "00000000-0000-0000-0000-000000000001",
  "record_type": "CR",
  "version": "2.0.0",
  "actor_id": "a0000000-0000-0000-0000-000000000001",
  "counterpart_id": null,
  "content": {
    "rule_id": "r0000000-0000-0000-0000-000000000001",
    "rule_version": "1.0.0",
    "rule_type": "ABSOLUTE",
    "priority": 1,
    "trigger": {
      "type": "event",
      "conditions": [{ "field": "record_hash", "operator": "modified", "value": true }]
    },
    "action": {
      "type": "block_and_alert",
      "parameters": { "alert_class": "CONSTITUTIONAL_BREACH" }
    },
    "description": "AR-003: Ledger immutability enforcement. Any attempt to modify or delete a FIRMA record is blocked.",
    "created_by": "a0000000-0000-0000-0000-000000000001",
    "created_at": "2026-05-25T00:00:00Z",
    "supersedes": null
  },
  "coherence_score": 1.0,
  "timestamp_utc": "2026-05-25T00:00:00Z",
  "predecessor_hash": null,
  "record_hash": "b7e0c8f1a3d5e9f2b4c6a8d0e2f4a6b8c0d2e4f6a8b0c2d4e6f8a0b2c4d6e8f0a2b4c6d8e0f2a4b6c8d0e2f4a6b8c0d2e4f6a8b0c2d4e6f8a0b2c4d6e8f0",
  "signature": "TUVVQ0lRRDRBTkJnTnZoUXVQQjBWczJEWU5Xb3FDc3E3UWxhWnVQR2t3PT0=",
  "anchor_ref": null
}
