{
  "firma_id": "11111111-1111-1111-1111-111111111111",
  "record_type": "DR",
  "version": "2.0.0",
  "actor_id": "b1111111-1111-1111-1111-111111111111",
  "counterpart_id": "c1111111-1111-1111-1111-111111111111",
  "content": {
    "decision_id": "d1111111-1111-1111-1111-111111111111",
    "declared_intent": {
      "action": "approve_deal",
      "parameters": {
        "deal_value": 50000,
        "discount_percent": 10,
        "expected_close_date": "2026-07-15"
      }
    },
    "observed_reality": {
      "action": "approve_deal",
      "parameters": {
        "deal_value": 50000,
        "discount_percent": 35,
        "payment_history": "late_3x",
        "stakeholder_engagement": "low",
        "competitor_present": true
      }
    },
    "contradiction_signals": {
      "temporal": 0.10,
      "behavioural": 0.65,
      "quantitative": 0.71,
      "semantic": 0.30
    },
    "contradiction_score": 0.48,
    "confidence": 0.85,
    "narrative": "Discount of 35% significantly exceeds declared 10%. Combined with late payment history and low stakeholder engagement, this deal carries elevated risk. Recommend review before approval."
  },
  "coherence_score": 0.52,
  "timestamp_utc": "2026-06-16T10:30:00Z",
  "predecessor_hash": "b7e0c8f1a3d5e9f2b4c6a8d0e2f4a6b8c0d2e4f6a8b0c2d4e6f8a0b2c4d6e8f0a2b4c6d8e0f2a4b6c8d0e2f4a6b8c0d2e4f6a8b0c2d4e6f8a0b2c4d6e8f0",
  "record_hash": "a1b2c3d4e5f6a7b8c9d0e1f2a3b4c5d6e7f8a9b0c1d2e3f4a5b6c7d8e9f0a1b2c3d4e5f6a7b8c9d0e1f2a3b4c5d6e7f8a9b0c1d2e3f4a5b6c7d8e9f0a1b2",
  "signature": "c2lnbmVkX2J5X2FjdG9yX2IxMTExMTExXzExMTFfMTExMV8xMTExXzExMTExMTExMTExMQ==",
  "anchor_ref": null
}
